<?xml version="1.0" encoding="UTF-8"?>
<matrix name="test_matrix" xmlns="https://github.com/tddl/tddl/schema/matrix"
	xmlns:xsi="http://www.w3.org/2001/XMLSchema-instance"
	xsi:schemaLocation="https://github.com/tddl/tddl/schema/matrix https://raw.github.com/tddl/tddl/master/tddl-common/src/main/resources/META-INF/matrix.xsd">

	<group name="andor_group_0">
		<atom name="andor_group_0_atom0" ip="localhost" port="9900"
			status="R10" user-name="should not be here" password="should not be here"
			channelTimeout="2000000" />
		<atom name="andor_group_0_atom1" ip="localhost" port="9901"
			status="R10" user-name="should not be here" password="should not be here"
			channelTimeout="2000000" />
		<atom name="andor_group_0_atom2" ip="localhost" port="9902"
			status="R10" user-name="should not be here" password="should not be here"
			channelTimeout="2000000" />
	</group>

	<group name="andor_group_1">
		<atom name="andor_group_1_atom0" ip="localhost" port="9910"
			status="R10" user-name="should not be here" password="should not be here"
			channelTimeout="2000000" />
		<atom name="andor_group_1_atom1" ip="localhost" port="9911"
			status="R10" user-name="should not be here" password="should not be here"
			channelTimeout="2000000" />
		<atom name="andor_group_1_atom2" ip="localhost" port="9912"
			status="R10" user-name="should not be here" password="should not be here"
			channelTimeout="2000000" />
	</group>

	<group name="andor_group_2">
		<atom name="andor_group_2_atom0" ip="localhost" port="9920"
			status="R10" user-name="should not be here" password="should not be here"
			channelTimeout="2000000" />
		<atom name="andor_group_2_atom1" ip="localhost" port="9921"
			status="R10" user-name="should not be here" password="should not be here"
			channelTimeout="2000000" />
	</group>

	<group name="andor_group_oneAtom">
		<atom name="andor_group_atom" ip="localhost" port="9930" status="R10"
			user-name="should not be here" password="should not be here"
			channelTimeout="2000000" />
	</group>

	<!-- mysql group -->

	<group name="andor_mysql_group_0" type="my_async_jdbc" my_groupName="andor_mysql_group_0"
		my_appName="andor_mysql_qatest">
	</group>

	<group name="andor_mysql_group_1" type="my_async_jdbc" my_groupName="andor_mysql_group_1"
		my_appName="andor_mysql_qatest">
	</group>

	<group name="andor_mysql_group_2" type="my_async_jdbc" my_groupName="andor_mysql_group_2"
		my_appName="andor_mysql_qatest">
	</group>

	<group name="andor_mysql_group_oneAtom" type="my_async_jdbc"
		my_groupName="andor_mysql_group_0" my_appName="andor_mysql_qatest">
		<!-- <atom name="andor_mysql_group_atom" ip="localhost" port="9830" status="R10" 
			user-name="should not be here" password="should not be here" channelTimeout="2000000" 
			/> -->
	</group>
	
	<!-- tdhs group -->
	<group name="andor_tdhs_group_0" type="TDHS_CLIENT" my_groupName="andor_tdhs_group_0"
		my_appName="andor_tdhs_qatest">
	</group>

	<group name="andor_tdhs_group_1" type="TDHS_CLIENT" my_groupName="andor_tdhs_group_1"
		my_appName="andor_tdhs_qatest">
	</group>

	<group name="andor_tdhs_group_2" type="TDHS_CLIENT" my_groupName="andor_tdhs_group_2"
		my_appName="andor_tdhs_qatest">
	</group>
   <group name="andor_tdhs_group_atom" type="TDHS_CLIENT" my_groupName="andor_tdhs_group_atom"
      my_appName="andor_tdhs_qatest">
   </group>

</machine-tapologic>